{"dependency_versions":{"duckdb":"1.5.1","pyarrow":"21.0.0"},"duckdb_transaction_marker":"cf643886eb06560f4a025eedf88d7f0e55822d3482c6fe6a2e09645f19abae30","exports":[{"export_id":"export_gj91n8wge7m67qrykz9jj72ttq","export_idempotency_key":"116d063209ace639f9c3a2212e9526650ae0dd00f67203f82ee936e7355df755","logical_hash":"5631c9f4eb9c85049b467bb2cdafafe4427d594d0712eae44226abf4e7cca51a","logical_layer":"core_provenance","manifest_hash":"1cef58dd41754adb7847fd7c5e0656480a13d44f360623685b7b4892211e4b91","manifest_relative_path":"exports/export_gj91n8wge7m67qrykz9jj72ttq/manifest.json","row_count":2,"rows_hash":"5631c9f4eb9c85049b467bb2cdafafe4427d594d0712eae44226abf4e7cca51a","source_registry_ref":{"relative_path":"runs/V02/run_1z2zwtbt9dvd5cgs3y1wkgdrqy/artifact_registry.jsonl","storage_root_ref":"repository"},"source_run_id":"run_1z2zwtbt9dvd5cgs3y1wkgdrqy","storage_root_ref":"ubuntu_v02_claim_warehouse"}],"load_batch":{"batch_hash":"c62cc19cba0da7e3cecf0a943f6fab50eec1db851d3e742ce09498e14a6833af","completed_at":"2026-07-20T03:01:00Z","export_count":1,"load_batch_id":"load_batch_f4yzqe9n6e8yk6vjvv1ynhk80m","load_batch_schema_version":"claim_warehouse_load_batch_v1.0.0","load_plan_hash":"e531af3319444ebf49d6043d03d479f2085591776989f6eb47ab15a94136e547","load_plan_id":"load_plan_k957eghg7s7nzsc1btxcqgwntf","logical_hash":"39c28babfb9ec26a456e7f086de42d61f71b00ed8454d8d5319c7a76c5107520","row_count":2,"started_at":"2026-07-20T03:00:00Z","status":"succeeded"},"load_receipt_schema_version":"claim_warehouse_load_receipt_v1.0.0","parquet_manifest":[{"export_id":"export_gj91n8wge7m67qrykz9jj72ttq","file_hash":"1ef2f437aa6fdee321924b707f0e465beeb73eca81b0d47e35d383d8385fc6ac","logical_layer":"core_provenance","relative_path":"parquet/logical_layer=core_provenance/table_code=run/schema_version=truthfulness_db_v02.1.0/run_date=2026-07-20/export_id=export_gj91n8wge7m67qrykz9jj72ttq/part-00000.parquet","row_count":1,"row_logical_hash":"c9f0e04301c9cad394c7c59adf3fdb47cddf2e891717db3a31a69093997b0a9c","size_bytes":4941,"table_code":"run"},{"export_id":"export_gj91n8wge7m67qrykz9jj72ttq","file_hash":"7ff2f55b8162bcfd374bd046e570404e13fc69f32e733ed4db962f0e8a918b92","logical_layer":"core_provenance","relative_path":"parquet/logical_layer=core_provenance/table_code=source_media/schema_version=truthfulness_db_v02.1.0/run_date=2026-07-20/export_id=export_gj91n8wge7m67qrykz9jj72ttq/part-00000.parquet","row_count":1,"row_logical_hash":"b1072a0b3c8bd92fa9207382aedefb347a784ebd2a871b2f2e60ba6fff826e0e","size_bytes":4684,"table_code":"source_media"}],"receipt_hash":"7e02f88a8023fedec3429dcf162546648d147b44cafe3ec66485c2c969317225","receipt_id":"load_receipt_f4yzqe9n6e8yk6vjvv1ynhk80m","receipt_relative_path":"receipts/load_receipt_f4yzqe9n6e8yk6vjvv1ynhk80m.json","row_counts":{"run":1,"source_media":1},"watermark":{"core_provenance":"export_gj91n8wge7m67qrykz9jj72ttq"}}
